{
  "schema_version": "1.0",
  "session_id": "sample-no-change",
  "phase": "complete",
  "host_capabilities": {
    "schema_version": "1.0",
    "host": "generic-agent-skills",
    "host_version": null,
    "surface": "unknown",
    "observed_at": "2026-08-31T00:00:00Z",
    "skill_loading": "manual",
    "persistent_instruction": "unknown",
    "execution": {"read": "available", "write": "unavailable", "shell": "unknown", "browser": "unknown"},
    "network": "none",
    "code_intelligence": {"text_search": "available", "lsp": "unknown", "ast": "unknown", "static_analysis": "unknown", "compiler": "unknown", "tests": "unknown", "profiler": "unknown"},
    "delegation": "none",
    "isolation": "unknown",
    "permissions": "advisory",
    "mcp": "unavailable",
    "hooks": {"availability": "unavailable", "events": []},
    "enforcement": [{"operation": "repository-write", "status": "unsupported", "surface": "generic", "evidence": "read-only fixture"}]
  },
  "engineering_contract": {
    "objective": "Review whether an already bounded implementation needs change.",
    "scope": {"included": ["current implementation and callers"], "excluded": ["unrelated refactors"]},
    "decision_authority": "review",
    "implementation_authority": "none",
    "maturity": "production",
    "supported_environments": ["current supported platform"],
    "expected_scale": "bounded",
    "distribution_model": "existing application",
    "hard_constraints": ["preserve behavior"],
    "success_criteria": ["identify whether material change is justified"]
  },
  "assumptions": [],
  "system_model": {
    "modules": ["reviewed module"],
    "callers": ["known caller"],
    "callees": [],
    "public_contracts": ["existing behavior"],
    "state": [],
    "boundaries": [],
    "deployment_flows": [],
    "user_flows": ["existing behavior"],
    "blast_radius": "local and reversible",
    "unknowns": []
  },
  "quality_scenarios": [],
  "risk_register": {"selected_depth": "D1", "depth_reasons": ["bounded review with known caller"], "risks": []},
  "evidence_ledger": [{"id": "E1", "claim": "The baseline satisfies the stated contract.", "evidence_type": "observed", "source": "fixture inspection", "version_or_date": "2026-08-31", "applicability": "fixture only", "confidence": "high", "contradicting_evidence": [], "unknowns": [], "decision_effect": "preserve baseline"}],
  "candidate_set": {"baseline_candidate_id": "baseline", "candidates": [{"id": "baseline", "summary": "Keep the existing implementation.", "viable": true, "hard_constraint_failures": [], "scenario_value": ["preserves behavior"], "lifecycle_burden": ["no migration or maintenance increase"], "residual_risks": []}]},
  "decision_record": {"selected_candidate_id": "baseline", "rationale": "No decision-relevant evidence justifies a change.", "rejected_alternatives": [], "assumption_ids": [], "evidence_ids": ["E1"], "interfaces": ["existing behavior"], "fallbacks": [], "migration": null, "rollback": null, "recovery": null, "resource_expectations": [], "verification_claim_ids": ["V1"], "residual_risk_ids": []},
  "verification_claims": [{"id": "V1", "claim": "No change is justified for the fixture.", "required_evidence": ["contract and current implementation comparison"], "status": "supported", "evidence_ids": ["E1"], "applicability": "fixture only", "uncertainty": ""}],
  "residual_risks": []
}
